"File Name","Input Field Name","Type & Description","Property field status","Data Type","Default","Valid value range","Cyber field status","Liability field status"
"ReinsScope","CedantName","Cedant name:  used for defining treaty scope in the reinsurance scope file","O","varchar(40)","n/a","","O","O"
"ReinsScope","ProducerName","Producer name:  used for defining treaty scope in the reinsurance scope file","O","varchar(40)","n/a","","O","O"
"ReinsScope","LOB","Line of business:  used for defining treaty scope in the reinsurance scope file","O","varchar(20)","n/a","","O","O"
"ReinsScope","CountryCode","Country code: used for defining treaty scope in the reinsurance scope file","O","char(2)","n/a","","O","O"
"ReinsScope","ReinsTag","Reinsurance tag: user defined field to for defining treaty scope in the reinsurance scope file","O","varchar(20)","n/a","","O","O"
"ReinsScope","CededPercent","Ceded percentage (for 12%, enter 0.12). Within the reinsurance scope file, CededPercent should only be entered for surplus share treaties.","CR","float","1","[0,1]","CR","CR"
"ReinsInfo","RiskLevel","Code to indicate the definition of 'risk' for the per-risk terms in this particular treaty (or portion of the treaty)","CR","char(3)","n/a","","CR","CR"
"Loc","StaticMotorVehicle","Identifies whether a risk is static or dynamic (moves from location to location)","O","tinyint","0","[0,1]","n/a","n/a"
"Acc","CondClass","Flags whether a condition is a policy restriction","O","tinyint","0","[0,1]","n/a","n/a"
"Acc; Loc","CondTag","Identifies a group of locations which are subject to one or more conditions.","CR","varchar(20)","n/a","","n/a","n/a"
"Acc; Loc; ReinsInfo; ReinsScope","OEDVersion","The OED schema version of the file - 'major, minor, patch' format i.e. (2.0.0)","O","varchar(10)","latest version","","O","O"
"Loc","IsAggregate","Agggrated Data based on NumberOfBuildings field","O","tinyint","0","[0,1]","n/a","n/a"
"Loc","OccupantPeriod","Period/time of day/season for 'NumberOfOccupants'","O","tinyint","0","[0,8]","n/a","n/a"
"Loc","SoilType","0 = no soil information, 1 = time averaged shear-wave velocity to 30m depth (vs30 (m/s))","O","tinyint","0","[0,1]","n/a","n/a"
"Loc","SoilValue","The value associated with the SoilType and the corresponding unit","O","float","0","[0,)","n/a","n/a"
"Loc","NumberOfOccupants","Total number of occupants at a location (e.g., residents, employees, visitors)","O","int","0","[0,)","n/a","n/a"
"Loc","OccupantUnderfive","Number of occupants aged under 5 years","O","int","0","[0,)","n/a","n/a"
"Loc","OccupantOver65","Number of occupants aged over 65 years","O","int","0","[0,)","n/a","n/a"
"Loc","OccupantAge5to65","Number of occupants aged 5-65 years","O","int","0","[0,)","n/a","n/a"
"Loc","OccupantFemale","Number of female occupants ","O","int","0","[0,)","n/a","n/a"
"Loc","OccupantMale","Number of male occupants","O","int","0","[0,)","n/a","n/a"
"Loc","OccupantOther","Number of occupants who identify as non-binary or other gender","O","int","0","[0,)","n/a","n/a"
"Loc","OccupantUrban","Number of occupants classed as living in an urban area","O","int","0","[0,)","n/a","n/a"
"Loc","OccupantRural","Number of occupants classed as living in a rural area","O","int","0","[0,)","n/a","n/a"
"Loc","OccupantPoverty","Number of occupants classed as living in poverty","O","int","0","[0,)","n/a","n/a"
"Loc","OccupantRefugee","Number of occupants with refugee status","O","int","0","[0,)","n/a","n/a"
"Loc","OccupantUnemployed","Number of occupants classed as unemployed","O","int","0","[0,)","n/a","n/a"
"Loc","OccupantDisability","Number of occupants with a disability","O","int","0","[0,)","n/a","n/a"
"Loc","OccupantEthnicMinority","Number of ethnic minority occupants ","O","int","0","[0,)","n/a","n/a"
"Loc","OccupantTemporary","Number of temporary occupants (e.g., tourists)","O","int","0","[0,)","n/a","n/a"
"Acc; Loc; ReinsInfo","OriginalCurrency","Original currency in which the business has been written before any conversions","O","char(3)","n/a","","O","O"
"Acc; Loc; ReinsInfo","RateOfExchange","Rate of exchange used to convert the terms from OriginalCurrency","O","float","0","[0,)","O","O"
"Loc","OffshoreWaterDepth","Depth of water for offshore structures (in metres)","O","float","n/a","(,0]","n/a","n/a"
"Loc","SectionLength","Length of line element associated with point location. Intended for line-assets, such as roads, railways and cables. Such an asset can be defined as a series of points along its length, and the 'Length' field describes the length associated with each point. E.g. if a road is coded as points at 2km intervals, then the 'Length' value is 2, and the TIV represents the value for that 2km stretch of road.","O","float","n/a","[0,)","n/a","n/a"
"Loc","PowerCapacity","The electrical capacity (e.g. in MW) associated with an infrastructure asset. Intended for power generation and power transmission assets. E.g. power stations, turbines, cables, etc.
Provide the generating capacity of each asset (e.g. for a turbine, this is the capacity of the turbine, not the windfarm).","O","float","n/a","[0,)","n/a","n/a"
"Loc","VulnerabilitySetID","ID allowing custom location level vulnerability to be captured","O","int","n/a","[0,)","n/a","n/a"
"Loc","BuildingFloodVuln","Building relative vulnerability to flood","O","tinyint","n/a","[0,)","n/a","n/a"
"Loc","BIFloodVuln","BI relative vulnerability to flood","O","tinyint","n/a","[0,)","n/a","n/a"
"Loc","Geom","Geometry of the location: refer to http://postgis.net/workshops/postgis-intro/geometries.html","O","varchar(250)","n/a","","n/a","n/a"
"Loc","CodeProvision","Code provision for energy, water and communication infrastructure","O","tinyint","","[0,)","n/a","n/a"
"Loc","Anchorage","Anchorage of for energy, water and communication infrastructure","O","tinyint","","[0,)","n/a","n/a"
"Loc","DiameterOfPipeline","Diameter of pipeline","O","tinyint","","[0,)","n/a","n/a"
"Loc","VoltageOfEnergy","Voltage of energy infrastructure (applicable to substations, generation facilities and transmission)","O","tinyint","","[0,)","n/a","n/a"
"Loc","PumpingCapacity","Capacity of water pumping and treatment plants, in MGD (Millions gallons per day)","O","tinyint","","[0,)","n/a","n/a"
"Acc","AccParticipation","Insurance company share of the account loss. Values between 0 to 1 (e.g. 12% entered as 0.12)","O","float","1","[0,1]","n/a","n/a"
"Acc","CompanyIDSchemeXX","Company identification scheme. Eg. DUNS, LEI. See 'OtherValues'","CR","varchar(5)","n/a","","CR","CR"
"Acc","CompanyIDCodeXX","Company identifier related to the CompanyIDScheme","CR","int","0","[0,)","CR","CR"
"Acc","YearFounded","Year that insured entity founded to support company identification (YYYY format)","O","smallInt","0","","O","O"
"Acc","StreetAddress","Main street address of insured entity","O","nvarchar(100)","n/a","","O","O"
"Acc","PostalCode","Postal code of main address for insured entity ","O","nvarchar(20)","n/a","","O","O"
"Acc","City","City of main address for insured entity ","O","nvarchar(50)","n/a","","O","O"
"Acc","CountryCode","Country code for the country of domicile of the insured entity - see 'CountryValues'","O","char(2)","n/a","","O","O"
"Acc","AreaCode","Area code of main address for insured entity - see 'AreaCodeValues'","O","char(3)","n/a","","O","O"
"Acc","IndustrySchemeXX","Industry scheme i.e NAISC, USSIC, UKSIC. See 'OtherValues'","CR","varchar(5)","n/a","","R","CR"
"Acc","IndustryCodeXX","Industry code from the IndustryScheme - see 'IndustryCodeValues'","CR","int","0","[0,)","R","CR"
"Acc","IndustryVintageXX","Vintage of Industry code used (YYYY format)","O","smallInt","0","[0,)","O","O"
"Acc","IndustryDescription","Concise industry description (associated with IndustryCode or free form)","O","nvarchar(250)","n/a","","O","O"
"Acc","NumberOfEmployees","Most recent estimate of number of employees","O","int","0","[0,)","O","O"
"Acc","AnnualRevenue","Most recent estimate for annual total gross income (not profit)","CR","float","0","[0,)","R","CR"
"Acc","AnnualRevenueCurrency","Currency for AnnualRevenue in three digit format. See 'CurrencyValues'","CR","char(3)","n/a","","R","CR"
"Acc","GrossProfitMargin","Gross Profit Margin of company in percentage (0.1 = 10%)","O","float","0","[0,)","O","O"
"Acc","NumberOfRecords","Estimated number of records accessed","O","int","0","[0,)","O","n/a"
"Acc","URL","Link to website","O","varchar(250)","n/a","","O","O"
"Acc","IsPackage","Policy Type - Standalone (0), Package (1)","n/a","smallInt","0","","O","n/a"
"Acc","PolDed","Policy Deductible (monetary value for all coverages - non-property)","n/a","float","0","[0,)","R","O"
"Acc","StackedPolNumber","If not unique indicates policy stacking (e.g. policies part of same insurance tower)","n/a","varchar(20)","n/a","","O","O"
"Acc","LayerAggAttachment","Policy layer attachment (aggregate basis)","n/a","float","0","[0,)","O","O"
"Acc","LayerAggLimit","100% policy layer limit (aggregate basis) ","n/a","float","0","[0,)","O","O"
"Acc","PolLimitBI","Sub-limit for (non-property) BI - see 'CoverageValues' ","n/a","float","0","[0,)","O","n/a"
"Acc","PolDedBI","Sub-deductible for (non-property) BI - see 'CoverageValues' ","n/a","float","0","[0,)","O","n/a"
"Acc","PolLimitCBI","Sub-limit for CONTINGENT BI - see 'CoverageValues' ","n/a","float","0","[0,)","O","n/a"
"Acc","PolDedCBI","Sub-deductible for CONTINGENT BI- see 'CoverageValues' ","n/a","float","0","[0,)","O","n/a"
"Acc","PolLimitDIAS","Sub-limit for DIGITAL ASSETS - see 'CoverageValues' ","n/a","float","0","[0,)","O","n/a"
"Acc","PolDedDIAS","Sub-deductible for DIGITAL ASSETS - see 'CoverageValues' ","n/a","float","0","[0,)","O","n/a"
"Acc","PolLimitEXT","Sub-limit for EXTORTION - see 'CoverageValues' ","n/a","float","0","[0,)","O","n/a"
"Acc","PolDedEXT","Sub-deductible for EXTORTION - see 'CoverageValues' ","n/a","float","0","[0,)","O","n/a"
"Acc","PolLimitFIN","Sub-limit for FINANCIAL FRAUD - see 'CoverageValues' ","n/a","float","0","[0,)","O","n/a"
"Acc","PolDedFIN","Sub-deductible for FINANCIAL FRAUD - see 'CoverageValues' ","n/a","float","0","[0,)","O","n/a"
"Acc","PolLimitINRE","Sub-limit for INCIDENT RESPONSE - see 'CoverageValues' ","n/a","float","0","[0,)","O","n/a"
"Acc","PolDedINRE","Sub-deductible for INCIDENT RESPONSE - see 'CoverageValues' ","n/a","float","0","[0,)","O","n/a"
"Acc","PolLimitLIA","Sub-limit for LIABILITY - see 'CoverageValues' ","n/a","float","0","[0,)","O","n/a"
"Acc","PolDedLIA","Sub-deductible for LIABILITY - see 'CoverageValues' ","n/a","float","0","[0,)","O","n/a"
"Acc","PolLimitREG","Sub-limit for REGULATORY - see 'CoverageValues' ","n/a","float","0","[0,)","O","n/a"
"Acc","PolDedREG","Sub-deductible for REGULATORY - see 'CoverageValues' ","n/a","float","0","[0,)","O","n/a"
"Acc","PolLimitENO","Sub-limit for ERRORS & OMISSIONS - see 'CoverageValues' ","n/a","float","0","[0,)","O","n/a"
"Acc","PolDedENO","Sub-deductible for ERRORS & OMISSIONS - see 'CoverageValues' ","n/a","float","0","[0,)","O","n/a"
"Acc","LimitCurrency","Limit Currency for all Coverages -  see 'CurrencyValues'","n/a","char(3)","n/a","","O","n/a"
"Acc","DedCurrency","Deductible Currency for all currencies -  see 'CurrencyValues'","n/a","char(3)","n/a","","O","n/a"
"Acc","PolSIR","Self Insured Retention","n/a","float","0","[0,)","O","O"
"Acc","PolCoverage","List of coverages in policy - see 'CoverageValues'","n/a","varchar(250)","CYB'","","O","n/a"
"Acc","OSVendor","Operating System, Code - see 'OtherValues'","n/a","Integer","0","[0,10]","O","n/a"
"Acc","CloudVendor","Cloud vendor Code - see 'OtherValues'","n/a","Integer","0","[0,6]","O","n/a"
"Acc","EmailVendor","Email vendor Code - see 'OtherValues'","n/a","Integer","0","[0,13]","O","n/a"
"Acc","CRMVendor","Customer Relationship Management vendor code - see 'OtherValues'","n/a","Integer","0","[0,8]","O","n/a"
"Acc","PatchPolicy","Cadence of patches to the 'main system' - 0-Unknown/1-Never/2-Daily/3-Weekly/4-Monthly/5-Annually/6-Ad-hoc","n/a","tinyint","0","[0,6]","O","n/a"
"Acc","BackUpFreq","Cadence of back-up of the 'main servers' - 0-Unknown/1-Never/2-Daily/3-Weekly/4-Monthly/5-Annually/6-Ad-hoc","n/a","tinyint","0","[0,6]","O","n/a"
"Acc","AreaName","AreaName of main address for insured entity - see 'AreaCodeValues'","O","nvarchar(50)","n/a","","O","O"
"Acc","CoverageClassDescription","Concise class of business description for the policy coverage (free form)","n/a","nvarchar(100)","n/a","","n/a","R"
"Acc","CoverageTerritory","Concise territorial description for the policy coverage (free form)","n/a","nvarchar(100)","n/a","","n/a","O"
"Acc","CoverageTrigger","Options: 0-Claims Made or 1-Losses Occurring or 2-Occurrence Reported","n/a","tinyint","0","[0,2]","n/a","O"
"Acc","IsGroupCover","Is the policy coverage extended to subsidiaries of the insured party; Options: 0-No or 1-Yes","n/a","smallInt","0","[0,1]","n/a","O"
"Acc","DefenceCost","Options: 0-Outside the limit, 1-Inside the limit or 2-Not Covered","n/a","tinyint","0","[0,2]","n/a","O"
"Acc","BIWaitingPeriod","BI waiting period defined at policy level (in days)","n/a","float","0","[0,)","O","n/a"
"Acc","BIPOI","BI period of indemnity defined at policy level (in days, in increments of 0.5 days). Default value = 365 (1 year).","n/a","float","365","[0,3650]","O","n/a"
"Loc","SoilLiquefiable","Defines whether a soil is susceptible to liquefaction or not.","O","int","0","[0,2]","n/a","n/a"
"Acc","InsuredName","Full legal name of insured party","O","nvarchar(100)","n/a","","R","R"
