ReinsInfo,InuringPriority,Reinsurance inuring priority capturing the order in which reinsurance contracts apply. Treaties with lower number inuring priorities apply first.,R,tinyint,NO,n/a,,,ReinsuranceInfo,
ReinsInfo,ReinsType,Type of reinsurance contract,R,varchar(3),NO,n/a,,,ReinsuranceInfo,
ReinsInfo,AttachmentBasis,Reinsurance attachment basis,O,char(2),YES,('LO'),,,ReinsuranceInfo,
ReinsInfo,Reinstatement,Number of reinstatements,O,tinyint,YES,n/a,,,ReinsuranceInfo,
ReinsInfo,ReinstatementCharge,"Reinstatement charge as %; semi-colon separated if different for each reinstatement (e.g. 1-free, 2-50%, 3-100% should be entered as: 0;0.5;1). If all reinstatements are the same, then just one number is sufficient (e.g. 3 reinstatements at 100% should be entered as 1)",O,varchar(50),YES,n/a,,,ReinsuranceInfo,
ReinsInfo,ReinsPremium,Reinsurance premium,O,float,YES,0,"[0,)",,ReinsuranceInfo,
ReinsInfo,DeemedPercentPlaced,"Deemed percent placed, used to represent notional contracts or any part of the contract being notional. For fully notional contracts, enter 1 (i.e. 100%). For partially placed contracts, enter any value between 0 and 1. For real contracts, enter 0.",O,float,YES,0,"[0,1]",,ReinsuranceInfo,
ReinsInfo,ReinsFXrate,Reinsurance exchange rate (as the contractual reinsurance rate can be different from the actual exchange rates used for policies and locations),O,float,YES,1,"[0,)",,ReinsuranceInfo,
ReinsInfo,TreatyShare,The percentage of a treaty that a given reinsurer may write. Values between 0 to 1 (e.g. 12% entered as 0.12).,O,float,YES,1,"[0,1]",,ReinsuranceInfo,
ReinsInfo,UseReinsDates,A flag to indicate if reinsurance contract dates or  policy inception / expiry dates are to be considered when calculating losses (Y) or ignored (N).,O,char(1),YES,N,,,ReinsuranceInfo,
ReinsScope,ReinsNumber,Reinsurance number to link with ReinsInfo file,R,int,NO,n/a,"[1,)",,ReinsuranceScope,
ReinsScope,PortNumber,Portfolio number: used for defining treaty scope in the reinsurance scope file,CR,varchar(20),YES,n/a,,,ReinsuranceScope,
ReinsScope,AccNumber,Account number:  used for defining treaty scope in the reinsurance scope file,CR,nvarchar(40),YES,n/a,,,ReinsuranceScope,
ReinsScope,PolNumber,Policy number:  used for defining treaty scope in the reinsurance scope file,CR,varchar(20),YES,n/a,,,ReinsuranceScope,
ReinsScope,LocGroup,Location group name:  used for defining treaty scope in the reinsurance scope file,CR,nvarchar(20),YES,n/a,,,ReinsLoc; ReinsuranceScope,
ReinsScope,LocNumber,Location number:  used for defining treaty scope in the reinsurance scope file,CR,nvarchar(20),YES,n/a,,,ReinsuranceScope,
ReinsScope,CedantName,Cedant name:  used for defining treaty scope in the reinsurance scope file,CR,varchar(40),YES,n/a,,,ReinsuranceScope,
ReinsScope,ProducerName,Producer name:  used for defining treaty scope in the reinsurance scope file,CR,varchar(40),YES,n/a,,,ReinsuranceScope,
ReinsScope,LOB,Line of business:  used for defining treaty scope in the reinsurance scope file,CR,varchar(20),YES,n/a,,,ReinsuranceScope,
ReinsScope,CountryCode,Country code: used for defining treaty scope in the reinsurance scope file,O,char(2),YES,n/a,,,ReinsuranceScope,
ReinsScope,ReinsTag,Reinsurance tag: user defined field to for defining treaty scope in the reinsurance scope file,CR,varchar(20),YES,n/a,,,ReinsuranceScope,
ReinsScope,CededPercent,"Ceded percentage (for 12%, enter 0.12). Within the reinsurance scope file, CededPercent should only be entered for surplus share treaties.",CR,float,YES,1,"[0,1]",,ReinsAcc; ReinsPol; ReinsLoc; ReinsuranceScope,
ReinsScope,RiskLevel,Code to indicate the definition of 'risk' for the per-risk terms in this particular treaty (or portion of the treaty),R,char(3),YES,n/a,,,ReinsLoc; ReinsuranceScope,